{
  "archetype": "伞形长枪",
  "roleInfluence": "天文馆穹幕放映员",
  "visualInfluences": ["星盘", "投影镜片", "胶片匣", "穹幕支架"],
  "composition": {
    "mainShape": "长枪与折叠伞结合的实体武器",
    "handle": "深靛色长枪杆，握持区有黑色防滑缠带和小型胶片刻度",
    "headOrCore": "枪尖下方展开半透明暗银星盘伞骨，中心有一枚圆形投影镜片",
    "secondaryParts": ["枪杆侧面固定小型胶片匣", "伞骨边缘有少量暖银星孔", "枪尾有短穹幕钥片"],
    "silhouette": "长枪轮廓清楚，伞盘展开成可读的圆形护幕"
  },
  "material": {
    "primary": "暗银金属枪尖与伞骨",
    "secondary": "深靛枪杆、黑色缠带、透明镜片、胶片匣",
    "finish": "金属和镜片干净，低亮反射",
    "wearState": "整洁、舞台设备感、无灰尘"
  },
  "combatFunction": "远近距离戳刺、展开护幕、折射光线封路",
  "weaponName": "穹幕星枪",
  "imagePromptBreakdown": "一把可被清楚识别为长枪的实体武器，深靛色长枪杆带黑色防滑缠带，枪尖下方展开暗银星盘伞骨，中心嵌一枚圆形投影镜片；枪杆侧面固定小型胶片匣，伞骨边缘有少量暖银星孔，枪尾挂短穹幕钥片。",
  "bans": ["不要画成普通雨伞", "不要只画星空光效", "不要强烈大面积发光", "不要文字或星座标签"]
}

