{
  "archetype": "斧头",
  "roleInfluence": "花匠",
  "visualInfluences": ["荆棘", "蔷薇", "水管", "护理良好的金属工具"],
  "composition": {
    "mainShape": "单刃园艺斧",
    "handle": "木质长斧柄，荆棘缠绕整段柄身，部分握把包裹柔软水管",
    "headOrCore": "镜面抛光钢制斧刃，刃面有植物叶脉状刻纹",
    "secondaryParts": ["三朵大小不同的深红蔷薇盛开在斧头连接处", "荆棘沿木质长柄缠绕"],
    "silhouette": "宽斧头轮廓，花束感集中在斧头上半部"
  },
  "material": {
    "primary": "护理良好的银色金属",
    "secondary": "木质长柄、柔软水管、深红蔷薇与荆棘",
    "finish": "钢制斧刃镜面抛光，干净反光",
    "wearState": "整洁、无锈、无泥污"
  },
  "combatFunction": "近身劈砍与钩拉控制",
  "weaponName": "荆棘花束",
  "imagePromptBreakdown": "荆棘缠绕整个木质长斧柄，靠近斧头连接处盛开三朵大小不同的深红蔷薇，部分握把被柔软水管缠绕，镜面抛光钢制斧刃，刃面有植物叶脉状刻纹。",
  "bans": ["不要只画花束", "不要抽象概念", "不要绿色发光", "不要普通园艺剪"]
}
