{
  "archetype": "长柄锤",
  "roleInfluence": "地下档案封签护库员",
  "visualInfluences": ["封蜡", "档案夹", "钥匙牌", "金属压印章"],
  "composition": {
    "mainShape": "长柄单手战锤",
    "handle": "黑色硬木长柄，握持处包裹深红封蜡色防滑皮带",
    "headOrCore": "方形银黑金属锤头，一侧像平整印章面，另一侧是短钝破封尖",
    "secondaryParts": ["锤头边缘嵌入小型档案编号牌", "柄尾挂一枚旧银钥匙牌", "锤面有低亮冷蓝封签纹"],
    "silhouette": "可一眼读成战锤，档案元素只作为结构装饰"
  },
  "material": {
    "primary": "哑光银黑金属",
    "secondary": "黑色硬木、深红封蜡色皮带、旧银钥匙牌",
    "finish": "金属边缘干净，印章面平整清楚",
    "wearState": "整洁、厚重、无泥污"
  },
  "combatFunction": "近身压制、破封、格挡和短距离击退",
  "weaponName": "封页锤",
  "imagePromptBreakdown": "一把可被清楚识别为长柄战锤的实体武器，黑色硬木柄外缠深红封蜡色防滑皮带，方形银黑锤头一侧是平整印章面，另一侧有短钝破封尖；锤头边缘嵌着小型档案编号牌，柄尾挂旧银钥匙牌，锤面只有少量冷蓝低光封签纹。",
  "bans": ["不要画成一本书", "不要只画印章", "不要抽象规则", "不要文字标签"]
}

